{
  "findings": [
    {
      "criterion_id": "fidelity",
      "evidence_refs": [
        {
          "id": "Qualified_Intake.json",
          "sha256": "fe67f22340de7e402f4e77c0bb6893fad9ed193176547eb9bf7a0c51900b3112"
        },
        {
          "id": "Intent_IR.json",
          "sha256": "534b21488d83ada6f1824708da845eb460b8149cfb075eb4ecbde433ad116fac"
        }
      ],
      "outcome": "PASS",
      "reason": "The artifact faithfully preserves the requested latency investigation, retrieval-quality preservation, local execution, exclusions, and evidence-grounded report without inventing methods, numerical targets, or empirical results."
    },
    {
      "criterion_id": "coverage",
      "evidence_refs": [
        {
          "id": "Qualified_Intake.json",
          "sha256": "fe67f22340de7e402f4e77c0bb6893fad9ed193176547eb9bf7a0c51900b3112"
        },
        {
          "id": "Intent_IR.json",
          "sha256": "534b21488d83ada6f1824708da845eb460b8149cfb075eb4ecbde433ad116fac"
        }
      ],
      "outcome": "PASS",
      "reason": "All material source obligations are represented: reduce baseline latency while preserving retrieval quality, keep all work local, exclude cloud training and new datasets, and report the baseline comparison and limitations. The absence of supplied measurements is also captured."
    },
    {
      "criterion_id": "consistency",
      "evidence_refs": [
        {
          "id": "Intent_IR.json",
          "sha256": "534b21488d83ada6f1824708da845eb460b8149cfb075eb4ecbde433ad116fac"
        },
        {
          "id": "Qualified_Intake.json",
          "sha256": "fe67f22340de7e402f4e77c0bb6893fad9ed193176547eb9bf7a0c51900b3112"
        }
      ],
      "outcome": "PASS",
      "reason": "The baseline, metrics, scope, targets, exclusions, and constraints are mutually consistent. Readiness to investigate does not contradict the acknowledged absence of empirical measurements or assert demonstrated improvement."
    },
    {
      "criterion_id": "requirements_usability",
      "evidence_refs": [
        {
          "id": "Qualified_Intake.json",
          "sha256": "fe67f22340de7e402f4e77c0bb6893fad9ed193176547eb9bf7a0c51900b3112"
        },
        {
          "id": "Intent_IR.json",
          "sha256": "534b21488d83ada6f1824708da845eb460b8149cfb075eb4ecbde433ad116fac"
        }
      ],
      "outcome": "PASS",
      "reason": "The artifact supplies an actionable investigation goal and concrete report deliverable, with explicit execution and quality constraints. Unchosen methods and numerical thresholds do not prevent beginning the requested research."
    }
  ],
  "limitations": [
    "No empirical measurements are supplied; acceptance of the intent does not establish latency improvement or preserved retrieval quality.",
    "Investigation methods and numerical evaluation thresholds remain unspecified by the sources."
  ],
  "required_correction": null,
  "review_context_ref": {
    "id": "Intention_Review_Context.json",
    "sha256": "d339e96dcc2ea70b5afd2b043220f8ebd231ab4b076929cbc239a6f92ac2d0a1"
  },
  "schema_version": "1.0.0",
  "subject_ref": {
    "id": "Intent_IR.json",
    "sha256": "534b21488d83ada6f1824708da845eb460b8149cfb075eb4ecbde433ad116fac"
  },
  "uncertainties": [],
  "verdict": "PASS_WITH_KNOWN_LIMITATIONS"
}
